id,name,description,source,owner
agricultural_area,Agricultural area,"The sum arable land, permanent crops, and permanent pastures.","FAO, Statistics Division",FAO
agricultural_production_indices,Agricultural production indices,"The FAO indices of agricultural production show the relative level of the aggregate volume of agricultural production for each year in comparison with the base period 2004-2006. They are based on the sum of price-weighted quantities of different agricultural commodities produced after deductions of quantities used as seed and feed weighted in a similar manner. All the indices are calculated by the Laspeyres formula. Production quantities – except for fish – of each commodity – except for fish – are weighted by 2004-2006 average international commodity prices and summed for each year. To obtain the index, the aggregate for a given year is divided by the average aggregate for the base period 2004-2006. The fish index is only normalized to the base period 2004-06.Since the FAO indices are based on the concept of agriculture as a single enterprise, amounts of seed and feed are subtracted from the production data to avoid double counting them, once in the production data and once with the crops or livestock produced from them. Deductions for seed (in the case of eggs, for hatching) and for livestock and poultry feed apply to both domestically produced and imported commodities. They cover only primary agricultural products destined to animal feed (e.g. maize, potatoes, milk, etc.). Processed and semi-processed feed items such as bran, oilcakes, meals and molasses have been completely excluded from the calculations at all stages. When calculating indices of agricultural, food and nonfood production, all intermediate primary inputs of agricultural origin are deducted. However, for indices of any other commodity group, only inputs originating from within the same group are deducted; thus, only seed is removed from the group “crops” and from all crop subgroups, such as cereals, oil crops, etc.; and both feed and seed originating from within the livestock sector (e.g. milk feed, hatching eggs) are removed from the group “livestock products”. For the main two livestock subgroups, namely, meat and milk, only feed originating from the respective subgroup is removed. International commodity prices are used in order to avoid the use of exchange rates for obtaining continental and world aggregates and to improve international comparative analysis of productivity at the national level. These ”international prices”, expressed in ”international dollars,” are derived using a Geary-Khamis formula for the agricultural sector. This method assigns a single “price” to each commodity. The commodities covered in the computation of indices of agricultural production are all crops and livestock products originating in each country. The category of food production includes commodities that are considered edible and that contain nutrients, although it does not include fish. Accordingly, coffee and tea are excluded along with inedible commodities because, although edible, they have practically no nutritive value. Indices for meat production are computed based on data for production from indigenous animals, which takes account of the meat equivalent of exported live animals but excludes the meat equivalent of imported live animals. For index purposes, annual changes in livestock and poultry numbers or in their average live weight are not taken into account.","FAO, Statistics Division and Fisheries Division",FAO
agriculture_orientation_index,Agriculture orientation index (AOI),"Measures the ratio of the agriculture share of government expenditures, over the agriculture contribution to the economy. An AOI greater than 1 gives more prominence to agriculture than its contribution to the economy, as measured by GDP, while those with an AOI less than 1 give more prominence to non-agricultural sectors.","FAO, Statistics Division",FAO
agriculture_value_added_per_worker,Agriculture value added per worker,"Agriculture comprises value added from forestry, hunting, and fishing as well as cultivation of crops and livestock production. Data are in constant 2000 U.S. dollars. Agricultural productivity is measured by value added per unit of input. Agricultural value added includes that from forestry and fishing. Data on employment are drawn from labor force surveys, household surveys, official estimates, censuses and administrative records of social insurance schemes, and establishment surveys when no other information is available. The concept of employment generally refers to people above a certain age who worked, or who held a job, during a reference period. Employment data include both full-time and part-time workers.",World Bank,IMF and FAO
anemia_among_children_under_5_years_of_age._prevalence_(pros),"Anemia among children under 5 years of age, prevalence (\%)",The percentage of children under age 5 whose hemoglobin level is less than 110 grams per liter at sea level.,World Bank,"WHO. Global anemia prevalence and trends 1995-2011. Geneva: World Health Organization; forthcoming. Stevens GA, Finucane MM, De-Regil LM, et al. Global, regional, and national trends in hemoglobin concentration and prevalence of total and severe anemia in children and pregnant and non-pregnant women for 1995-2011: a systematic analysis of population-representative data. The Lancet Global Health 2013; 1(1): e16-e25."
anemia_women_in_reproductive_age_(pros),"Anemia, women in reproductive age (\%)",missing,missing,missing
aquaculture_fish_production,Aquaculture fish production,"Defined as the farming of aquatic organisms. Farmingimplies some form of intervention in the rearing process to enhance production, such as regular stocking, feeding, protection from predators, etc. Farming also implies individual or corporate ownership of the stock being cultivated. For statistical purposes, aquatic organisms which are harvested by an individual or corporate body which has owned them throughout their rearing period contribute to aquaculture, while aquatic organisms which are exploitable by the public as a common property resource, with or without appropriate licenses, are the harvest of fisheries. In the case of capture-based aquaculture, only the incremental growth (or weight gain) in captivity, could and should be reported as the production from aquaculture. Data included here covers an aquaculture production of fish, molluscs, crustaceans and miscellaneous aquatic animals but excluding production for marine mammals, crocodiles, corals, pearls, sponges and aquatic plants. Fish production is the sum of aquaculture and capture fish production.",Fisheries and Aquaculture Department (Fishery and Aquaculture statistics),FAO
arable_land,Arable land,"The land under temporary agricultural crops (multiple-cropped areas are counted only once), temporary meadows for mowing or pasture, land under market and kitchen gardens and land temporarily fallow (less than five years). The abandoned land resulting from shifting cultivation is not included in this category. Data for arable land are not meant to indicate the amount of land that is potentially cultivable.","FAO, Statistics Division",FAO
area_equipped_for_irrigation,Area equipped for irrigation,"Area equipped to provide water (via irrigation) to crops. It includes areas equipped for full/partial control irrigation, equipped lowland areas, and areas equipped for spate irrigation.",Land and Water Division (AQUASTAT),FAO
area_harvested,Area harvested,"Refer to the area from which a crop is gathered. Area harvested, therefore, excludes the area from which, although sown or planted, there was no harvest due to damage, failure, etc. It is usually net of temporary crops and sometimes gross of permanent crops. Net area differs from gross area insofar as the latter includes uncultivated patches, footpaths, ditches, headlands, shoulders, shelterbelts, etc. If the crop under consideration is harvested more than once during the year as a consequence of successive cropping (i.e. the same crop is sown or planted more than once in the same field during the year), the area is counted as many times as harvested","FAO, Statistics Division  (FAOSTAT)",FAO
area_irrigated_(pros),Area irrigated (\%),"Percent of area equipped for irrigation that is actually irrigated in any given year, expressed in percentage. Irrigated land that is cultivated more than once a year is counted only once.",Land and Water Division (AQUASTAT),FAO
average_dietary_energy_supply_adequacy_(pros),Average dietary energy supply adequacy (\%),Expresses the Dietary Energy Supply (DES) as a percentage of the Average Dietary Energy Requirement (ADER). Each country's or region's average supply of calories for food consumption is normalized by the average dietary energy requirement estimated for its population to provide an index of adequacy of the food supply in terms of calories.,"FAO, Statistics Division",FAO
average_farm_size_(ha),Average farm size (ha),missing,missing,missing
average_protein_supply_of_animal_origin_(g_capita_day),Average protein supply of animal origin (g/capita/day),"Includes the following groups: meat; offals; animal fats and products; milk and products; eggs, fish, seafood and products; and aquatic products, other.","FAO, Statistics Division",FAO
bioenergy_consumption_in_agriculture,Bioenergy consumption in agriculture,missing,missing,missing
total_bioenergy_consumption,total Bioenergy consumption,missing,missing,missing
total_energy_consumption_for_power_irrigation,total Energy consumption for power irrigation,missing,missing,missing
biofuel_production_(thousand_kt_of_oil_eq.),Biofuel production (thousand kt of oil eq.),"Fuel that is produced through biological processes, including agriculture. They can be derived directly from plants, or indirectly from agricultural, commercial, domestic, and/or industrial wastes.",United Nations Statistics Division,United Nations Statistics Division
capture_fish_production,Capture fish production,"Defined as the hunting, collecting and gathering activities directed at removing or collecting live wild aquatic organisms. The capture production statistics here indicates the nominal catches of aquatic organisms, killed, caught, trapped or collected for all commercial, industrial, recreational and subsistence purposes in live weight equivalent. Data included here covers capture production of fish, molluscs, crustaceans and miscellaneous aquatic animals but excluding production for marine mammals, crocodiles, corals, pearls, sponges and aquatic plants. Fish production is the sum of aquaculture and capture fish production.",Fisheries and Aquaculture Department (Fishery and Aquaculture statistics),FAO
cattle,Cattle,"Common ox (Bos taurus); zebu, humped ox (Bos indicus); Asiatic ox (subgenus Bibos); Tibetan yak (Poephagus grunniens).","FAO, Statistics Division",FAO
cereal_import_dependency_ratio,Cereal import dependency ratio,Tells how much of the available domestic food supply of cereals has been imported and how much comes from the country's own production. It is computed as (cereal imports - cereal exports)/(cereal production + cereal imports - cereal exports) * 100. Given this formula the indicator assumes only values <= 100. Negative values indicate that the country is a net exporter of cereals.,"FAO, Statistics Division",FAO
cereals,Cereals,"Include wheat, rice paddy, barley, maize, popcorn, rye, oats, millets, sorghum, buckwheat, quinoa, fonio, triticale, canary seed, mixed grain and cereals nes.","FAO, Statistics Division",FAO
change_in_food_CPI,Change in food CPI,missing,missing,missing
children_under_5_years_of_age_affected_by_wasting_(pros),Children under 5 years of age affected by wasting (\%),The proportion of children under five whose weight for height is more than two standard deviations below the median for the international reference population ages 0-59.,World Bank,"World Health Organization, Global Database on Child Growth and Malnutrition"
children_under_5_years_of_age_who_are_stunted_(pros),Children under 5 years of age who are stunted (\%),"Height-for-age less than -2 standard deviations of the WHO Child Growth Standards median, among children aged 0-5 years.",World Bank,"World Health Organization, Global Database on Child Growth and Malnutrition"
coffee_export_green,"Coffee export, Green",Coffee trade,"FAO, Statistics Division",FAO
coffee_export_roasted,"Coffee export, Roasted",Coffee trade,"FAO, Statistics Division",FAO
coffee_export_extracts,"Coffee export, Extracts",Coffee trade,"FAO, Statistics Division",FAO
coffee_import_green,"Coffee import, Green",Coffee trade,"FAO, Statistics Division",FAO
coffee_import_roasted,"Coffee import, Roasted",Coffee trade,"FAO, Statistics Division",FAO
coffee_import_extracts,"Coffee import, Extracts",Coffee trade,"FAO, Statistics Division",FAO
coffee_producer_prices,"Producer prices, green coffee (US\$ per tonne)",Coffee producer prices,"FAO, Statistics Division",FAO
coffee_area_harvested,Coffee area harvested,Coffee area harvested,"FAO, Statistics Division",FAO
coffee_yield,Coffee yield,Coffee yield,"FAO, Statistics Division",FAO
coffee_production_quantity,Coffee production quantity,Coffee production quantity,"FAO, Statistics Division",FAO
coffee_production_value,Coffee production value,Coffee production value,"FAO, Statistics Division",FAO
coffeebook_vegetal_(crop)_products,Vegetal (crop) products (kcal/cap/day),Vegetal (crop) products (kcal/cap/day),"FAO, Statistics Division",FAO
coffeebook_animal_products_(kcal_cap_day),Animal products (kcal/cap/day),Animal products (kcal/cap/day),"FAO, Statistics Division",FAO
crop_production,Crop production,"Refer to the actual harvested production from the field or orchard and gardens, excluding harvesting and threshing losses and that part of crop not harvested for any reason. Production therefore includes the quantities of the commodity sold in the market (marketed production) and the quantities consumed or used by the producers (auto-consumption). When the production data available refers to a production period falling into two successive calendar years and it is not possible to allocate the relative production to each of them, it is usual to refer production data to that year into which the bulk of the production falls. Crop production data are recorded in tonnes (t). In many countries, crop production data are obtained as a function of the estimated yield and the total area. If such a compilation method of production statistics is enforced by the country, it must be ensured that the total area does not refer to sown or planted area, which would give then the biological production, but to the actually harvested area during the year.","FAO, Statistics Division",FAO
cropland,Cropland,Includes arable land and permanent crops.,"FAO, Statistics Division",FAO
cropping_intensity_ratio,Cropping Intensity Ratio,The ratio of area harvested to total arable land. The cropping intensity may exceed 100 percent where more than one crop cycle is permitted each year on the same area.,"FAO, Statistics Division  (FAOSTAT)",FAO
current_account_balance_(pros_GDP),Current account balance (\% GDP),missing,missing,missing
dietary_energy_supply_(kcal_pc_day),Dietary energy supply (kcal/pc/day),"The food available for human consumption, expressed in kilocalories per person per day. At the country level, it is calculated as the food remaining for human use after taking out all non-food utilization, including exports, industrial use, animal feed, seed, wastage and changes in stocks.","FAO, Statistics Division",FAO
dietary_energy_supply._cereals._roots_and_tubers_(pros),"Dietary energy supply, cereals, roots and tubers (\%)","Expresses the energy supply (in kcal/caput/day) provided by cereals, roots and tubers as a percentage of the total Dietary Energy Supply (DES) (in kcal/caput/day) calculated from the corresponding countries in the FAOSTAT food balance sheets.","FAO, Statistics Division",FAO
domestic_food_price_level_index,Domestic food price level index,"An indicator of the relative price of food in a country. The indicator is calculated from the 2011 International Comparison Program (ICP) data from the World Bank as well as general and food consumer price indices from the International Labour Organization made consistent and available on FAOSTAT.  Specifically, the ratio of food and non-alcoholic beverages expenditure to actual individual consumption is calculated in purchasing power parity terms relative to  the United States. To control for inflation, this ratio is forecasted and backcasted using the ratio of a country's Food Consumer Price Index (FPI) and General Consumer Price Index (CPI) using a 2011 base year, relative to the United States. The indicator is computed for countries for which International Comparison Program data as well as general and food consumer price indices are available.","FAO, Statistics Division",ILO and World Bank
domestic_food_price_volatility,Domestic food price volatility,"Measures the variability in the relative price of food in a country.  The indicator is calculated from the monthly domestic food price level index using monthly consumer and general food price indices and purchasing power parity data from the International Comparison Program conducted by the World Bank (see the Relative Price of Food Indicator for more information).  Month-to-month growth rates are calculated, and the standard deviation of these growth rates are calculated over the previous 8 months (8-months rolling standard deviation).  The average of these standard deviations is then computed to obtain an annual volatility indicator.","FAO, Statistics Division","FAO, ILO and World Bank"
employment_in_agriculture_(pros),Employment in agriculture (\%),"People who work for a public or private employer and receive remuneration in wages, salary, commission, tips, piece rates, or pay in kind. Agriculture corresponds to division 1 (ISIC revision 2) or tabulation categories A and B (ISIC revision 3) and includes hunting, forestry, and fishing.",World Bank,ILO
energy_use_intensity_in_agriculture_(mj_Idollar),Energy use intensity in agriculture (mj/I\$),missing,missing,missing
fertilizers_(kg_ha),Fertilizers (kg/ha),"Collected through individual countries in product weight through the new FAO Questionnaire on Agricultural Resources – Fertilizers and then converted to nutrients and validated for consistency regarding summary totals of production, import, export, non-fertilizer use and consumption for the three types of fertilizers: nitrogen (N), phosphate (P205), potash (K2O) and including complex fertilizers (NP, PK, NK and NPK).Fertilizers may be organic, inorganic or mineral. Organic fertilizers play an important role in crop production and are derived from animals, plants and compost. Mineral fertilizers are available to farmers in solid or liquid form, and are delivered to the farm either in bulk, in bags or in pressurized containers. All fertilizers contain at least one of the major plant nutrients: nitrogen (N), phosphorus (P) or potassium (K).","FAO, Statistics Division",FAO
food_imports_and_exports_(mln_usdollar),Food imports and exports (mln US\$),"Food comprises the commodities in SITC sections 0 (food and live animals), 1 (beverages and tobacco), and 4 (animal and vegetable oils and fats) and SITC division 22 (oil seeds, oil nuts, and oil kernels).","FAO, Statistics Division and Fisheries Division",FAO
food_production._average_value,"Food production, average value",In International Dollars (I\$) divided by the total population. It provides a cross country comparable measure of the relative economic size of the food production.,"FAO, Statistics Division",FAO
forestry_production,Forestry production,"The solid volume or weight of all production of the products specified below. It includes: the production of products that may immediately be consumed in the production of another product (e.g. wood pulp, which may immediately be converted into paper as part of a continuous process). It excludes: the production of veneer sheets that are used for plywood production within the same country. It is reported in cubic metres of solid volume in the case of roundwood, sawnwood and wood based panels and metric tons in the case of charcoal, pulp and paper products.","FAO, Statistics Division","Forestry Division, FAO"
forest_area_pros,Forest area (\%),"The land spanning more than 0.5 hectares with trees higher than 5 meters and a canopy cover of more than 10 percent, or trees able to reach these thresholds in situ. It does not include land that is predominantly under agricultural or urban land use. Forest is determined both by the presence of trees and the absence of other predominant land uses. The trees should be able to reach a minimum height of 5 metres (m) in situ. Areas under reforestation that have not yet reached but are expected to reach a canopy cover of 10 percent and a tree height of 5 m are included, as are temporarily unstocked areas, resulting from human intervention or natural causes, which are expected to regenerate. Includes: areas with bamboo and palms provided that height and canopy cover criteria are met; forest roads, firebreaks and other small open areas; forest in national parks, nature reserves and other protected areas such as those of specific scientific, historical, cultural or spiritual interest; windbreaks, shelterbelts and corridors of trees with an area of more than 0.5 ha and width of more than 20 m; plantations primarily used for forestry or protective purposes, such as: rubber-wood plantations and cork, oak stands. Excludes: tree stands in agricultural production systems, for example in fruit plantations and agroforestry systems. The term also excludes trees in urban parks and gardens.","Global Forest Resources Assessment, FAO",FAO
gdp_per_capita_(usdollar._ppp),"GDP per capita (US\$, PPP)",Gross domestic product converted to international dollars using purchasing power parity rates. An international dollar has the same purchasing power over GDP as the U.S. dollar has in the United States. GDP at purchaser's prices is the sum of gross value added by all resident producers in the economy plus any product taxes and minus any subsidies not included in the value of the products. It is calculated without making deductions for depreciation of fabricated assets or for depletion and degradation of natural resources. Data are in constant 2011 international dollars.,"FAO, Statistics Division",World Bank
government_expenditure_on_agriculture_(pros_total_outlays),Government expenditure on agriculture (\% total outlays),"Refers to Core Areas of Government Functions Relevant to the Agriculture Sector based on the Classification of Functions of Government (COFOG) as outlined in the IMFs Government Finance Statistics Manual, 2001 (GFSM 2001). Statistics on expenditures in agriculture, forestry and fisheries and on environmental protection can be used to study the effectiveness of government programs that support an enabling environment for essential public goods with high economic and social returns.","FAO, Statistics Division  (FAOSTAT)",FAO and IMF
greenhouse_gas_emissions_from_agriculture_(co2_eq._gigagrams),"Greenhouse gas emissions from agriculture (CO2 eq, gigagrams)","Contains all the emissions produced in the different agricultural emissions sub-domains, providing a picture of the contribution to the total amount of GHG emissions from agriculture.  GHG Emissions from agriculture consist of non-CO2 gases, namely methane (CH4) and nitrous oxide (N2O), produced by crop and livestock production and management activities.","FAO, Statistics Division",FAO
GHG_emissions_(AFOLU)_GHG_(all_sectors),GHG emissions (AFOLU)/GHG (all sectors),missing,missing,missing
growth_value_of_food_production,Growth value of food production,missing,missing,missing
health_expenditure_total_(pros_of_GDP),"Health expenditure, total (\% of GDP)",missing,missing,missing
health_expenditure_per_capita_PPP_(dollar),"Health expenditure per capita, PPP (\$)",missing,missing,missing
import_value_index_(2004_2006_=_100),Import value index (2004-2006 = 100),"Value indices represent the change in the currentvalues of Import c.i.f. (cost, insurance and freight) all expressed in US dollars. For countries which report import values on an f.o.b. (free on board) basis, these are adjusted to approximate c.i.f. values (by a standard factor of 112 percent).","FAO, Statistics Division",FAO
improved_water_source_(pros),Improved water source (\%),"Refers to the percentage of the population with reasonable access to an adequate amount of water from an improved source, such as a household connection, public standpipe, borehole, protected well or spring, and rainwater collection. Unimproved sources include vendors, tanker trucks, and unprotected wells and springs. Reasonable access is defined as the availability of at least 20 liters a person a day from a source within one kilometer of the dwelling.",World Bank,"World Health Organization and United Nations Children’s Fund, Joint Measurement Programme (JMP)"
income_share_held_by_highest_20percent_(percent),Income share held by highest 20\% (percent),Percentage share of income or consumption is the share that accrues to subgroups of population indicated by deciles or quintiles. Percentage shares by quintile may not sum to 100 because of rounding.,"World Bank, Development Research Group. Data are based on primary household survey data obtained from government statistical agencies and World Bank country departments. Data for high-income economies are from the Luxembourg Income Study database. For more information and methodology, please see PovcalNet (http://iresearch.worldbank.org/PovcalNet/index.htm).",World Bank (WDI)
