id,name,description,source,owner
iodine_deficiency_total_pop_(pros),"Iodine deficiency, total pop. (\%)",missing,missing,missing
labour_force_participation_rate,Labour force participation rate,The proportion of the population ages 15-64 that is economically active: all people who supply labour for the production of goods and services during a specified period.,World Bank,"KILM database, ILO"
life_expectancy_at_birth_(years),Life expectancy at birth (years),Indicates the number of years a newborn infant would live if prevailing patterns of mortality at the time of its birth were to stay the same throughout its life.,World Bank,UNPD World Population Prospects 2010
livestock_primary_production,Livestock primary production,"Include products from live and slaughtered animals. Products from slaughtered animals include meat, offals, raw fats, fresh hides and skins.  Products from live animals include milk, eggs, honey, beeswax and fibres of animal origin. All data shown relate to total meat production from both commercial and farm slaughter. Data are given in terms of dressed carcass weight, i.e. excluding offals and slaughter fats. Production of beef and buffalo meat includes veal; mutton and goat meat includes meat from lambs and kids, respectively; pig meat includes bacon and ham in fresh equivalent. Poultry meat includes meat from all domestic birds and refers, wherever possible, to ready-to-cook weight. Cow milk production relates to total production of whole fresh milk, excluding the milk sucked by young animals but including amounts fed to livestock. The concept of production of buffalo, sheep and goat milk is the same as for cow milk; however, the cover- age is probably less adequate. Egg production covers all domestic birds which have contributed to egg production during the year, wherever they lay and the corresponding total production, including eggs intended to be used for hatching but excluding waste on farms.","FAO, Statistics Division",FAO
milk,Milk,"Whole fresh milk production from Buffalos, Camels, Cows, Goats and Sheep.","FAO, Statistics Division",FAO
net_trade,Net trade,The sum of exports and imports of goods and services.,"FAO, Statistics Division",FAO
obesity_adults(pros),"Obesity, adults (M/F, \%)",missing,missing,missing
official_development_assistance_(oda),Official Development Assistance (ODA),"Consists of disbursements of loans made on concessional terms (net of repayments of principal) and grants by official agencies of the members of the Development Assistance Committee (DAC), by multilateral institutions, and by non-DAC countries to promote economic development and welfare in countries and territories in the DAC list of ODA recipients. It includes loans with a grant element of at least 25 percent (calculated at a rate of discount of 10 percent).",World Bank,"Development Assistance Committee of the Organisation for Economic Co-operation and Development, Geographical Distribution of Financial Flows to Developing Countries, Development Co-operation Report, and International Development Statistics database."
organic_area_(pros),Organic area (\%),"Sum of areas under ""Agricultural area certified organic"" and ""Agricultural area in conversion to organic"". Agricultural area certified organic is the land area exclusively dedicated to organic agriculture and managed by applying organic agriculture methods. It refers to the land area fully converted to organic agriculture. It is the portion of land area (including arable lands, pastures or wild areas) managed (cultivated) or wild harvested in accordance with specific organic standards or technical regulations and that has been inspected and approved by a certification body. Agricultural area in conversion to organic is the land area which is going through the organic conversion process, usually two years period of conversion to organic land.","FAO, Statistics Division",FAO
other_naturally_regenerated_forest,Other naturally regenerated forest,Naturally regenerated forest is forest predominantly composed of trees established through natural regeneration. Other naturally regenerated forest is forest where there are clearly visible indications of human activities.,"Global Forest Resources Assessment, FAO",FAO
overweight_adults_(pros),"Overweight, adults (M/F, \%)",missing,missing,missing
per_capita_food_production_variability_(constant_2004_2006_thousand_intdollar_per_capita),Per capita food production variability (constant 2004-2006 thousand int\$ per capita),"Corresponds to the variability of the ""food net per capita production value in constant 2004-2006 international dollars"" as disseminated in FAOSTAT.","FAO, Statistics Division",FAO
per_capita_food_supply_variability_(kcal_capita_day),Per capita food supply variability (kcal/capita/day),"Corresponds to the variability of the ""food supply in kcal/caput/day"" as disseminated in FAOSTAT.","FAO, Statistics Division",FAO
pesticides,Pesticides,"Refer to insecticides, fungicides, herbicides, disinfectants and any substance or mixture of substances intended for preventing, destroying or controlling any pest, including vectors of human or animal disease, unwanted species of plants or animals causing harm during or otherwise interfering with the production, processing, storage, transport or marketing of food, agricultural commodities, wood and wood products or animal feedstuffs, or substances which may be administered to animals for the control of insects, arachnids or other pests in or on their bodies. The term includes substances intended for use as a plant growth regulator, defoliant, desiccant or agent for thinning fruit or preventing the premature fall of fruit, and substances applied to crops either before or after harvest to protect the commodity from deterioration during storage and transport. Pesticides use data refers to quantities of pesticides applied to crops and seeds in the agriculture sector. Figures are expressed in metric tons of active ingredients. However, due to some country reporting practices, the data may be reported by: use in formulated product; sales; distribution or imports for use in the agricultural sector.","FAO, Statistics Division",FAO
planted_forest,Planted forest,Planted forest is forest predominantly composed of trees establishedthrough planting and/or deliberate seeding.,"Global Forest Resources Assessment, FAO",FAO
political_stability_and_absence_of_violence_terrorism_(index),Political stability and absence of violence/terrorism (index),"Measures perceptions of the likelihood that the government will be destabilized or overthrown by unconstitutional or violent means, including politically-motivated violence and terrorism.",World Bank,Brookings Institution and World Bank
population_with_access_to_sanitation_facilities_(pros),Population with access to sanitation facilities (\%),"Refers to the percentage of the population with at least adequate access to excreta disposal facilities that can effectively prevent human, animal, and insect contact with excreta. Improved facilities range from simple but protected pit latrines to flush toilets with a sewerage connection. To be effective, facilities must be correctly constructed and properly maintained.",World Bank,"World Health Organization and United Nations Children's Fund, Joint Measurement Programme (JMP)"
population._rural,"Population, rural","De facto population living in areas classified as rural (that is, it is the difference between the total population of a country and its urban population). Data refer to 1 July of the year indicated and are presented in thousands.","FAO, Statistics Division","United Nations Population Division, World Urbanization Prospects."
population._total,"Population, total","De facto population in a country, area or region as of 1 July of the year indicated.","FAO, Statistics Division",World Population Prospects: The 2012 Revision from the UN Population Division
population_growth_(pros),"Population, growth (\%)",missing,missing,missing
pop_affec_by_droughts_floods_extr_temp_(pros),"Pop affec by droughts, floods, extr temp (\%)",missing,missing,missing
poverty_headcount_ratio_at_dollar1.25_a_day_PPP_(percent_of_population),Poverty headcount ratio at \$1.25 a day PPP (percent of population),"Population below \$1.25 a day is the percentage of the population living on less than \$1.25 a day at 2005 international prices. As a result of revisions in PPP exchange rates, poverty rates for individual countries cannot be compared with poverty rates reported in earlier editions.","World Bank, Development Research Group. Data are based on primary household survey data obtained from government statistical agencies and World Bank country departments. Data for high-income economies are from the Luxembourg Income Study database. For more information and methodology, please see PovcalNet (http://iresearch.worldbank.org/PovcalNet/index.htm).",World Bank (WDI)
poverty_headcount_ratio_at_national_poverty_line_(percent_of_population),Poverty headcount ratio at national poverty line (percent of population),Poverty headcount ratio at national poverty line (\% of population).,Global Poverty Working Group. Data are based on World Bank's country poverty assessments and country Poverty Reduction Strategies.,World Bank (WDI)
poverty_headcount_ratio_at_rural_poverty_line_(percent_of_rural_population),Poverty headcount ratio at rural poverty line (percent of rural population),Rural poverty rate is the percentage of the rural population living below the national rural poverty line.,Global Poverty Working Group. Data are based on World Bank's country poverty assessments and country Poverty Reduction Strategies.,World Bank (WDI)
prevalence_of_undernourishment,Prevalence of undernourishment,Expresses the probability that a randomly selected individual from the population consumes an amount of calories that is insufficient to cover her/his energy requirement for an active and healthy life. The indicator is computed by comparing a probability distribution of habitual daily dietary energy consumption with a threshold level called the minimum dietary energy Requirement. Both are based on the notion of an average individual in the reference population.,"FAO, Statistics Division",FAO
primary_forest,Primary forest,"Naturally regenerated forest of native species, where there are no clearly visible indications of human activities and the ecological processes are not significantly disturbed.","Global Forest Resources Assessment, FAO",FAO
primary_completion_rate._total_(percent of relevant age group),"Primary completion rate, total (percent of relevant age group)","Primary completion rate is the percentage of students completing the last year of primary school. It is calculated by taking the total number of students in the last grade of primary school, minus the number of repeaters in that grade, divided by the total number of children of official graduation age.","United Nations Educational, Scientific, and Cultural Organization (UNESCO) Institute for Statistics.",World Bank (WDI)
renewable_water_resources_withdrawn_(pros_of_total),Renewable water resources withdrawn (\% of total),"The total volume of groundwater and surface water withdrawn from their sources for human use (in the agricultural, municipal and industrial sectors), expressed as a percentage of the total actual renewable water resources.",Land and Water Division (AQUASTAT) ,FAO
rice,Rice,"Oryza spp., mainly oryza sativa.  Rice grain after threshing and winnowing. Also known as rice in the husk and rough rice. Used mainly for human food.","FAO, Statistics Division",FAO
road_density_(per_100_sq_km_of_land_area),Road density (per 100 sq km of land area),"Includes motorways, highways, and main or national roads, secondary or regional roads, and all other roads in a country. A motorway is a road designed and built for motor traffic that separates the traffic flowing in opposite directions.",World Bank,"International Road Federation, World Road Statistics and electronic files"
roundwood_production_(mln_m3),Roundwood production (mln m3),missing,missing,missing
share_of_food_expenditure(pros),Share of food expenditure (\%),missing,missing,missing
terrestrial_protected_areas_(pros_total_land_area),Terrestrial protected areas (\% total land area),"Totally or partially protected areas of at least 1,000 hectares that are designated by national authorities as scientific reserves with limited public access, national parks, natural monuments, nature reserves or wildlife sanctuaries, protected landscapes, and areas managed mainly for sustainable use. Marine areas, unclassified areas, littoral (intertidal) areas, and sites protected under local or provincial law are excluded.",World Bank,"United Nations Environmental Program and the World Conservation Monitoring Centre, as compiled by the World Resources Institute"
the_depth_of_the_food_deficit_(pros),The depth of the food deficit (\%),"Indicates how many calories would be needed to lift the undernourished from their status, everything else being constant. The average intensity of food deprivation of the undernourished, estimated as the difference between the average dietary energy requirement and the average dietary energy consumption of the undernourished population (food-deprived), is multiplied by the number of undernourished to provide an estimate of the total food deficit in the country, which is then normalized by the total population.","FAO, Statistics Division",FAO
total_land_area,Total land area,The total area of the country excluding area under inland water bodies.,"FAO, Statistics Division",FAO
underweight._children_under_5_(pros),"Underweight, children under-5 (\%)",Percentage of underweight (weight-for-age less than -2 standard deviations of the WHO Child Growth Standards median) among children aged 0-5 years.,World Bank,"World Health Organization, Global Database on Child Growth and Malnutrition. Country-level data are unadjusted data from national surveys, and thus may not be comparable across countries."
value_added_from_agriculture_(pros_gdp),Value added from agriculture (\% GDP),"Agriculture corresponds to ISIC divisions 1-5 and includes forestry, hunting, and fishing, as well as cultivation of crops and livestock production. Value added is the net output of a sector after adding up all outputs and subtracting intermediate inputs. It is calculated without making deductions for depreciation of fabricated assets or depletion and degradation of natural resources. The origin of value added is determined by the International Standard Industrial Classification (ISIC), revision 3.","World Development Indicators, World Bank",IMF
value_of_food_(excluding_fish)_imports_over_total_merchandise_exports,Value of food (excluding fish) imports over total merchandise exports,"Provides a measure of vulnerability and captures the adequacy of foreign exchange reserves to pay for food imports, which has implications for national food security depending on production and trade patterns.","FAO, Statistics Division",FAO
water_resources_per_capita_(m3_person_year),Water resources per capita (m3/person/year),Total annual internal renewable water resources per inhabitant.,Land and Water Division (AQUASTAT),FAO
water_withdrawal._agriculture_(pros_of_total),"Water withdrawal, agriculture (\% of total)","Annual quantity of water withdrawn for irrigation, livestock and aquaculture purposes. It includes renewable freshwater resources as well as over-abstraction of renewable groundwater or withdrawal of fossil groundwater, use of agricultural drainage water, (treated) wastewater and desalinated water.",Land and Water Division (AQUASTAT),FAO
water_withdrawal._industrial_(pros_of_total_water_withdrawal),"Water withdrawal, industrial (\% of total water withdrawal)",Industrial water withdrawal as percentage of total water withdrawal.,Land and Water Division (AQUASTAT),FAO
wheat,Wheat,"Triticum spp.: common (T. aestivum) durum (T. durum) spelt (T. spelta). Common and durum wheat are the main types. Among common wheat, the main varieties are spring and winter, hard and soft, and red and white. At the national level, different varieties should be reported separately, reflecting their different uses. Used mainly for human food.","FAO, Statistics Division",FAO
vitamin_A_deficiency_total_pop_(pros),"Vitamin A deficiency, total pop. (\%)",missing,missing,missing
wood_pellet_production_(thousand_tonnes),Wood pellet production (thousand tonnes),"The most common type of pellet fuel and are generally made from compacted sawdust and related industrial wastes from the milling of lumber, manufacture of wood products and furniture, and construction. Other industrial waste sources include Empty Fruit Bunches [EFB], palm kernel shells, coconut shells, and tree tops and branches discarded during logging operations.","FAO, Statistics Division","Forestry Division, FAO"
